{
  "schemaVersion": 4,
  "learningNodeId": "grammar.nouns.countability",
  "skill": "grammar",
  "domain": "noun_phrases",
  "objective": "Use countable and uncountable nouns plus quantifiers to describe data without overgeneralising.",
  "priority": "P0",
  "assessmentMode": "hybrid",
  "progressChannels": ["mastery", "practice"],
  "completionContract": { "channel": "mastery", "ruleCode": "mastery.threshold", "target": 85, "minimumEvidence": 6 },
  "prerequisiteIds": [],
  "exerciseTypes": ["single_choice", "error_correction", "text_input"],
  "commonErrors": ["uncountable_plural", "quantifier_mismatch", "overgeneralisation", "quantifier_scope"],
  "transferTask": "Describe survey counts using accurate noun forms and bounded quantifiers.",
  "minimumVariants": 10,
  "sourceRefs": ["curriculum.grammar.nouns.countability", "p031.proof-pack.m2"],
  "reviewStatus": "codex_pre_reviewed",
  "reviewer": "Codex pre-review only; independent human review pending"
}
